,Unnamed: 0,Review Title,Review Text,Score,Class
0,0,Just wow!,"Absolutely worth for money. Battery life : Excellent battery life and pretty good charging speed. Chipset : SD860 is doing it's work. Amazing performance. Can't even imagine how did they brought a flagship chip into this price range.🤯Camera : Good camera for this price range.Display : Amoled display would have been great still 120hz is smooth although there's lack of depth in colours and when this mobile was tested with OP NORD aside, not looking great though.Software : I think tha...",4,Positive
1,1,Best in the market!,Just Amazing  Battery life : Excellent Battery Life And Charging speed is so good. Chipset : SNAPDRAGON 860 is Just Amazing at this Price Range. Camera : Good camera at this price but it needs some improvement. Display : 120 HZ Display.... SO SMOOTH.... Performance : Performance is speechless 🔥     JUST GO FOR IT 🔥,4,Positive
2,2,Very Good,"Nice phone in this budget, Liquidcool technology, cools down too fast. Good camera, nice battery, Good display, Very good performance. A big heavy due to battery but its okay causeBattery backup is good. Just go for it, You won't regret.",4,Positive
3,3,Fabulous!,"Nice phone at this price segment, 🚴三 fast and snapyJust missing Super AMOLED display, else it's super",4,Positive
4,4,Highly recommended,"Ohk so I ordered it on 13th JulyGot delivered on 17th July..In brief, the Device is excellent in performance..Ram management is good even it has miui.. worst ui.. still good Ram management.Camera 4/5Battery 5/5Display 4/5Performance 5/5For Gamers, I've done extreme test on this device...Smooth Extreme Sanhok Bootcamp 58 avg fpsHDR Extreme Sanhok Bootcamp 59 avg fpsAs it has 120hz panel, by using config, i unlocked 90 fps..Smooth 90 FPS Sanhok Bootcamp 82 avg fpsHDR 90 FPS Sanhok...",2,Negative
5,5,Super!,Simply awesome device. Performance of this mobile is mind blowing. I'm playing pubg in Ultra HD with extreme smoothness. And I have seen in most of the reviews that the camera quality was bad. So that attaching the photos that I captured on my mobile Poco X3 Pro and added a little adjustments. So that you can decide whether it is good or bad.        You feels like that you're in a mini theatre with these loud stereo speakers. Mobile design also looking good other than in the website or app. ...,5,Positive
6,6,Just wow!,"Those who are gonna buy this X3P knows very much about pros n cons of the device, I will not waste your n mine time in writing it. Instead I will share my experience of past 1 week with this X3P.1> First of all I want to clarify that don't compare this device to redmi note 10 series... Both the phones are targeted to different audience. 2> DISPLAY, I would say it's very nice display regarding the price at which you get it with SD860.Yeah I missed the deeper blacks and punchier colours of ...",3,Positive
7,7,Fabulous!,This mobile is easy to feel the power of 120 hz display and the processor also help to speed up process. The only problem is the battery drain quickly. The mobile is always  warm and you feel heat in your hand but the update only fix this issue. I already used poco X3.Poco x3 is slower than this but the battery backup is awesome and the mobile don't get heat for normal usage.So you are a Gamer choose this one but the battery last only 4hrs on heavy game like pubg and cod.you are normal u...,4,Positive
8,8,Simply awesome,"Great performance, superb battery, great display, premium look, stock camera is average but works wonders on installing google camera, overall best phone in this price range, the network speed has some issues which needs to be resolved",4,Positive
9,9,Good choice,"First & Foremost thanks Flipkart for safe & fast delivery, honestly receive the phone in well package fully satisfied with the delivery.My honest review about the phone 😊after using for 1 week. Performance is top notched due 2 Qualcom SD860 Chipset in this price segment no doubt. Battery backup also works good & lasts for a day even if we use continuously by playing games, watching videos,etc. Camera is average not up to the point. LCD display is good but not up to the point it should ...",5,Positive
10,10,Terrific purchase,Love this phone wow what a perfomance  nice camera pubg play very smooth+ extreme😍😍😍  battery backup was very good charge in 1hours.25 minutes  0% to 100% display was good camera was good i m loving with this phone i proud of that i choose good product ❤ gyes you can go with this ❤860 was the beast in this price range,5,Positive
11,11,Delightful,Unbeatable performance at this price range❣️Display is nice Camera give best photos G cam give good detailing📸Battery & charging department is also goodValue for money 💯💯,5,Positive
12,12,Must buy!,Got this beast today.. So happy with poco😍Amazing colour look so good. 120hz is awesome... U cant say it u can just feel it. Power of smoothness 😍I m in love with my poco😍Camera quality is also good . Bina Soche Buy karlo. 😍,5,Positive
13,13,Pretty good,Hey folks today it's my second day of the usage trust me guys the performance on this device is like butter just smooth AFU can definitely buy this for performance oriented purpose camera is average and battery is also good and descent on this device overall it's a great performance phone 👍👍,5,Positive
14,14,Delightful,Performance is to good 👍 . Camera is good but over surpness. And battery is good . Over all value of money . And it's a good phone.,4,Positive
15,15,Pretty good,Awesome performance Just like Flagship . processor is goodBut too  too too much HEATING ISSUES as well as fast charging is not so fast  who said camera is bad  indeed camera is best performance display everything awesome will edit after 1 month uses,4,Positive
16,16,Awesome,"Display is very nice and 120hz is smooth and sharp. Processes is best. Camera is average.Back vibration, so much when music is loud. But if you change the setting it is manageable. I like dual sterio spiker. This phone give fast charge with big battery and meny more feature. This phone is best under 20k.Absolutely worth of money.",4,Positive
17,17,Super!,It's processor is amazing which results in a smooth experience. Totally justifies its cost. Battery is powerful. Camera works fine. It's performance is best thanks to its processor. Extra 3k to get this processor is totally worth it. I loved it hopefully you will do too.,5,Positive
18,18,Highly recommended,excellent mobile. No lags..smooth display with 120 hz. display is not amoled but the screen quality is amazing. battery performance is superb and charging speed is also great. camera is good. photos have lot of details but video recording need to improve. stereo speakers are excellent,5,Positive
19,19,Very Good,"writing after one week1. Performance is best but little bit stuck due to MIUI 12,no matter it is 860 or 888 or 8888888 of 2050 if there is MIUI get ready for lag.2. Camera is not upto mark if you don't want to be insulted don't open it infront of others because people will judge by its price. 3. Display is good but brightness is not enough, previously i have redmi note 7 pro and that is brighter than this but this screen quality is good compare to note 7 pro 4.speaker is best just bes...",3,Positive
20,20,Really Nice,Phone processor is very good but speaker is very bad and aslo phone is very heavy. Battery backup awesome display good camera ok i will not say camera is awesome,3,Positive
21,21,Super!,Superb excellent fantastic amazing fabulous... Can't find words to express the feeling of penning this phone.,5,Positive
22,22,Perfect product!,"Awesome,👌Very nice quality at mid price smart phone, camera quality also too much surprised, just wow, image captured at different time and location, for the speed, quality and processor of this phone you can't compared to others mid price smart phone ,Came nicely packed but little bit late delivery ,  Never I think delivery was affected due to pandemic ,Just little bit disappointed ( but considerable) with two thing .One this is that the battery consumption and second one is mobile wei...",4,Positive
23,23,Terrible product,Been using it for > 1 month. In call proximity sensor doesnt work. Suddenly call goes on hold or goes to speaker mode due to face contact. To end call i have to click on end 3 times as it keeps jumping up and down. After applying tempered glass the touch response is pathetic. To scroll need to try multiple times as it wont detect scroll action on 1st attempt. Poco f1 was notches better in such simple things. Apart from processor its aa good as a Rs 5k phone. Pathetic.,1,Negative
24,24,Just wow!,"Great Product. Just Completed 3 Months using it and it works freakishly smooth. Gaming Experience is the best. Great Speaker & Sensors. It's like I lucked out by buying this Phone. A bit on the heavier side but other than that the processor and sensors balance it out with performance. Some say the Camera is not up to the mark but I would like to differ with them, I really liked the Camera Quality. 120 Hz refresh rate really works like wonder and the Qualcomm Snapdragon 860 Processor doesn't l...",5,Positive
25,25,im just done with MIUI (POCO launcher),Cameras are below average i would say (don't buy if you care about pictures/photos quality)It do heat up but it has 860 powerful SOC (also it's summer)  Not totally ad-free POCO might enable it in near futurePOCO also can install some apps via OTA updates (just like they did with POCO F1)Great phone for gamers (if they don't care much about privacy/DATA protection and bug/glitchy free UI experience)Battery is great actually and ram management is better than POCO F1 ( i am not gamer but a...,3,Positive
26,26,Not good,My 1month review:Lagging too much while gaming  and overheating makes the game more choppy and lagging....  Good for low end gaming not the best in market...   Don't buy this phone trust me. I feel very bad of buying this phone... I'm a gamer I've bought this mobile by seeing youtubers.  All the YouTube's are not genuine..  Don't trust youtubers..,2,Negative
27,27,Utterly Disappointed,"Not worth the hype!! Used it for 2 weeks. Firstly, flipkart took 1 week to deliver, which is crazy. Secondly, about the phone, it is really heavy, cameras are average, fast charger doesn't work as claimed, takes about 1 hours 45 minutes to fully charge from zero as opposed to 1 hour claim by the company. Really disappointing.Battery performance is also average. 4.5 hours of screen time only!! Screen is good but I felt it becoming in unresponsive so many times, may be due to the wet finge...",2,Negative
28,28,Nice product,HONEST REVIEW OF POCO X3 PROBroooo ... I just ordered it for pubg... And it's good for it too but .. THERE ARE HEATING ISSUES..IT GETS HEATED UP ONLY IN 1 TO 2 TDM MATCHES...SO IF YOU ARE A GAMER WHO PLAY FOR HOURS...YOU SHOULD DEFINITELY NOT GO FOR IT... ELSE EVERYTHING IS FINE... IT SUPPORTS ULTRA HD+ULTRA IN PUBG...NOW WHAT EXTRA DO WE NEED..??ALSO THERE IS ONE ISSUE WHICH FACED THAT IS IT'S SIM CARD TRAY IS NOT GETTING OUT EASILY....MEANS YOU NEED TO HAVE LONG NAILS AND MUCH FORCE...,3,Positive
29,29,Just okay,"This is going to be a long, and tough to write review...First, the pros+ Amazing performance, SD860 works like a charm+ Screen. The LCD panel used is very premium, and has very deep blacks, almost comparable to an AMOLED+ charging. It is fast, and power supply also supports other quick charging setups in samsung amd other phones... (OnePlus  warp charging not supported though)+ 3.5mm jackCons:- camera: even with Gcam, the 48MP camera is mediocre at best. 2MP macro camera is waste. Wi...",3,Positive
30,30,Nice product,"I like the phone, very good hardware. The design on the back looks bad, ngl, but that part is covered by my case, so I'm not complaining. I don't like the software, never liked MIUI, I never intended to use it. My intention was to install a stock android custom rom, which I did, and I'm loving my phone now.",4,Positive
31,31,Good,Writing this review helpful for the Poco x3 pro buyer here.I personally used it for 10days.Pros:- Powerful chip 860Soc performance is great.Stereo sound clarity is very good.Network connectivity is good.As heard it's not that bulky but weight balance is very good.Fast charging is nice in 33watt charger.Battery manage 1day with 4 hours online classes.ROM management is proper..Look wise ok.Cons:- Average Camera. Plastic back.Lacking behind in terms of Super Amoled display.Phone i...,3,Positive
32,32,Great product,"Awesome phone for gaming performance. Super nice camera quality. Back panel looks is superb. Overall performance best. If you buy this mobile then I suggest to you, you can definitely go to buy this. This phone is best for me. I love it.❤️",5,Positive
33,33,Wonderful,"Gaming is too good on this phone. I was getting constant 85 to 90 fps in 90 fps mode in pubg(patched). Awesome performance for this price.MIUI is like itself , you can turn off ads. I turned off every service and unticked every user agreement of miui except few that are needed and turned off data access for getapps and some other and i haven't got a single ads..btw UI has some bugs  , lags and stutter . miui is just average.Display is good for price .. super responsive and fast.(if display...",3,Positive
34,34,Delightful,"Reviewing after 5 months of usageCamera: 3/5Display: 4/5Battery:4/5Performance and gaming: 5/5Overall a good product, if you are someone who love to play games or like super fast phone then go for it, People who take pictures alot plz don't buy",3,Positive
35,35,Don't waste your money,Upgrade after redmi note 7 proI was going for samsung but I wanted performance oriented phone so I decided to buy itPros:Performance 💥💥💥Display is goodSpeaker is better than my previous phoneRead and write speed is insaneI can easily notice difference between 120 hz  and 60hzResponse rate is excellent 😊Cons:Device exceeds 40C after normal use ( I think it's due to miui can be fixed after update)Camera quality is 🤢.My redmi note 7 pro has better camera.(It can be improved using...,4,Positive
36,36,Really Nice,In gaming perspective u will see stunning visuals in every game as it's meant to do so ! For camera if you click in pro mode you'll get 22mb images and you will be amazed how good the camera is but then a subtle reminder will tell you that you bought it for Snapdragon 860👹Front camera makes your skin tone lighter and doesn't give natural skin tone(had to say this)!!,4,Positive
37,37,Worth every penny,"Superb poco x3pro, I order on 4 May got my order 8 May. I was worried coz cash on delivery is not available on my location pin no. But thanks to flipkart deliver my poco x3pro safe I am happy. Poco x3pro got a super processor run every thing smooth including high fps games. This is my one day use review I will update it later if I get any problem hope fully not  👍",5,Positive
38,38,Great product,Overall a good phone with a best processor in this price segment Nice displayDecent camera(It is not a highlight of this phone) Sndp 860 the beast🔥🔥🔥33 W fast chargerThe UI is little laggy but it will be updated All over a nice and a must buy phone,4,Positive
39,39,Super!,"Starting with design,i really like the design(my personal opinion)BUILD QUALITY -on front u get CG 6,back u get plastic which quality would have been done better DISPLAY - No issues with the display, that 120hz really amazing.CAMERA - At this price 48mp is not enough,but images are decent and other 3 are not bad and videos are stable u can go up-to 4k 30fps.CHARGING - U get 33 w charger which does it job good. It takes less than an hour to chargerSPEAKERS -speakers are loud and crisp but...",4,Positive
40,40,Simply awesome,"Right time delivery and my pocco x3 pro 6/128 awesome smartphone and camera good , speaker sound very good, and gaming experience very very good",5,Positive
41,41,Delightful,"It's again a Superb Spec phone as POCO F1. Everything is speedy and great so far. Facing bit bugs on MIUI though. Dark mode issues etc. If MIUI cares for a smooth UI experience, it'll be best phone at it's price. A Pro advice :- DON'T UPDATE MIUI PHONES, IF YOU WANT TO MAKE IT LAST LONG. 😃",4,Positive
42,42,Very Good,Camera is not bad. Macro mode works well. Poco should update some features like call recording. Call recording facility is very poor. Call recording quality also very poor. U can't record all calls. You can only record numbers which are not saved in your contacts. For saved contacts you need to add each  number one by one manually. Which is very horrible. I have used redmi note 8pro and 9pro. But some features are missing in Poco x3 pro. I wish poco should modify in it's next update. And I wi...,3,Positive
43,43,Worth the money,"I Was using Xiaomi Mi A1 form last 4 years. Experience of switching from old tech to this Powerful new gen tech Machine is on whole new level and i am loving it so much❤️I sacrificed better Camera, Amoled Display & 5G in this price range and picked the performance of SD 860⚡ Thankyou Filpkart !Thankyou Poco !",5,Positive
44,44,Good quality product,Best for gaming and everything else My experience with is good The camera of this device is too good 😊,4,Positive
45,45,Good choice,Poco X3 Pro need to optimise battery  otherwise the performance is very good and excellent I am using this mobile 10 days the camera quality is comparatively redmi note 9 Pro is equal when playing pubg almost 4 hours play back and very very important this is value for money,5,Positive
46,46,Best in the market!,Just get this !!! You may be disappointed by miui like me that to after just 2daysJust buy this unlock Bootloader install twrp and flash a custom rom at that level this is the best phone out there with a custom rom!!! For camera install gcam with a proper xml and it takes a lot better images than stock rom camera!,5,Positive
47,47,Good choice,Superb nice good very good aadipoli awesome wonderful,5,Positive
48,48,Terrific,"Awesome phone, just loved it mind-blowing performance and the camera is also great and the battery backup is also great Over all best deal in this budget. Thanks Flipkart Really loved it.",5,Positive
49,49,Nice product,"I've used Poco F1📱 for 2 years and upgraded to Poco X3 pro(6gb RAM) 📱 and this is my review after using for 5 days..🔹performance is good (smooth 120hz), 🔹Gaming is good for price, 🔹Camera is average (go for Redmi_Note_10_pro_max if camera is your priority) 🔹 Battery backup is good,🔹 haptic feedback (vibration) is not satisfactory,🔹Speaker volume is Ok,🔹 Phone size is big and somewhat heavy (215g)I will update my review later.",3,Positive
50,50,Wonderful,"Been using this phone for over a week now, and after receiving the phone i immediately update it to 12.5, and some people say it would decrease the performance but as far i have experienced the performance is top notch for the price range, what more do you want... Some say it heat too much, but according to my usage i haven't seen the issue regarding overheat. I played BGMI in smooth extreme, so far it didn't cause any heat, just little bit warm, that's common for every device. I played Aspha...",4,Positive
51,51,best at this price,"Pros - Runs almost all heavy games smoothLoud and clear speakersSmooth display, good colorsHuge batteryQuick reliable fingerprint sensorWater resistant to some extentCons - Big and heavy almost like a brick. If you hit some one with this on the head they may die, which you can count as a pro rather than a con is some situations.",4,Positive
52,52,Nice product,Perfect smooth for for this prize range.All apps and PUBG works ultra smooth without lagingCamera is Good but not as good as expected (Ok..this is a Gaming Phone) Normal use got 26 hr battery life..Overall satisfied..Value for money..,4,Positive
53,53,Best in the market!,"Display is good I am using this phone from 20 days nd this is best gaming phone under 20000, the processor 860 doing it's work well, battery is a downgrade for this phone cuz it's drain faster than any other else , maybe it's because of new miui 12.5 update. I hope this problem maybe fix in future. Nd to be honest I think miui is the only reason which stopping it from shining in the sky . Otherwise this smartphone is a beast . It is a worth of money",3,Positive
54,54,Fabulous!,"VERY HAPPY WITH THIS PHONE,THIS PHONE WONT DISAPPOINT YOU SOME PROS AND CONS ABOUT THE PHONE                                                             Pros- ONE THE BEST PROCESSOR IN THE BUDGET.CAMERA IS GOOD IF U KNOW HOW TO USE IT IN A PROPER WAY ,BATTERY TOP NOTCH,SCREEN SMOOTHER THAN BUTTER AND BATTERY WONT AFFECT TOO MUCH AND YES GOO! For it                                                                     😀 THERE ARE NO CONS BUT DON’T UPDATE THE PHONE THATS ALL",4,Positive
55,55,Wonderful,Phone is very good for gaming. I just love it. But you have to sacrifice 5G. And if you want a all rounder phone then you should go for other options.And if you happy with the lil heavy weight and no 5G and  you want beast performance under 20 thousands then must gor for this phone. ✌️,4,Positive
56,56,Nice product,"Very nice phone extra fast. very powerful processor, nice build well finished. Powerful stereo speakers. ClearBut. Xiomi made it worst. They made very poor ui it cannot use all the power of processor.. Poor camera ui. Xiomi must work on it. Powerful Battery 8 hrs BGMI play. Full charge in 1 hr. overall very Nice phone.",3,Positive
57,57,Just wow!,Nice phone Performance is good Battery is mediumCamera is also averageIf u are thinking to buy this phone for gaming and normal usage its the best,4,Positive
58,58,Delightful,Excellent phone for daily usage and gaming. Cons It heat slightly when chargingRear camera does not click good pics in dim lightNo 5g There are many stock apps like mi pay etc which are uselessNo amoledPros Sd 860 120hz33 watt fast charging 3mm jack Notification ledFront camera impressive Stereo speaker Under 20k best buy if 5g is not your priority,4,Positive
59,59,Great product,Poco X3 Pro More ⚡Power to youUnbeatable Performance at this Price range❣️Camera ~ Good Imaging ExperienceFHD+ Display Protection ~ Corning Gorilla 6Refresh Rate ~ 120Hz Smart Display (Reality Flow) Touch Sampling Rate ~ 240HzExcellent 5160 mAh Battery Life33W Superfast Charging Speed🔋⚡Charging Time ~ 1hr 10min LiquidCool Plus Technology ~ Cooldown To Fast 🚴三Super-fast processor ~ Qualcomm Snapdragon 860 (7nm)CPU ~ Octa core 2.96 GHzGPU ~ Adreno 6401)📷Camera 4/52)🔋Batter...,5,Positive
60,60,Great product,The greatest mobile phone ever with super performance as a gaming phone weight is not that heavy like youtubers said . Camera is good quality more than realme 7 best mobile under 20k,5,Positive
61,61,Wonderful,Im using this phone from a month and here is my honest reviewFirst of all i bought this phone not for gaming but for future proofing myself cause it comes with SD860 processor . For gamers no doubt this phone is awesome but im giving my review not based on gaming or performance . I saw lots of people in review section complaining about camera quality.  Personally i found the cameras Excellent . Heres my detailed review for camera 1 . Normal lense(48MP) (wide) - 5/5 Pictures are sharp det...,2,Negative
62,62,Good choice,Mainly as we know it's a device which totally based on proformance no doubt it's performance is good enough.. Battery life is not as expected it Only get discharged in 5-6 hours in gaming mode.. I'm using it from past 2days..these are things which I mainly felt ☺☺.... Camera is also good as it have pro features which gaves u a pic in hdr mode😇.... Charging is also fast ( full battery charged in 1 hour approx)  weightwise it's not so heavy looks are also cool specially that punchhole camera😂😂,3,Positive
63,63,Worth the money,"Go for it if you game, you can call it a gaming phone under 20k, only for gaming nothing else it has got a decent battery life with avg cameras and (2/5) rated display, well we cannot expect amoled with this sd 860 soc in this price  range and there are some glitches with ui, hope they will be fixed in an update and yeah go for it if you need a performance beast at this price range... And I got it for 17k so worth it",4,Positive
64,64,Super!,"Quite amazing product. This is very impressive in this price segment. All aspects are good and I dont even care about  the screen whether its Amoled or IPS and this phone's screen is very nice and I like it.Before buying this phone, I heard a lot about the Battery Charging time and Camera, to be honest, EXCELLENT on both of the segment. I really didn't expect from POCO X series. I am proud to be a member of poco family.And also a big thanks to Flipkart team, its you that made us smile alw...",5,Positive
65,65,Best in the market!,Phone is nice but camera and display quality is average i have been using redmi k20 pro before I don't find this device as good as redmi k20 pro in any thing if you are a gamer you will like it but if you are photoholic then you will not like this device,3,Positive
66,66,Good quality product,Best smartphone under 20000And best processor - Snapdragon 860Camera is not goodBut value for moneyAnd best battery backupAnd good display,4,Positive
67,67,Wonderful,"Upgraded from my old poco f1 almost same, sound better performance faster and display is bigger than poco f1, camera is average but gets the job done. 120 hz is smooth but consumes more battery. I'm satisfied one more thing dual stereo speakers are loud but the background vibrates little bit",4,Positive
