,Unnamed: 0,Review Title,Review Text,Score,Class
681,681,Not recommended at all,Having lot of issue with working of the mobile won't auto rotate even if it is on call sensor won't work,2,Negative
682,682,Hated it!,Mobile suddenly shutdown after 9months of usage Motherboard problem. Please don't go for this mobile ver bad performance poco,1,Negative
683,683,Not recommended at all,"motherboard problem, no repair",1,Negative
684,684,Nice,Poco camera good quality,3,Positive
685,685,Terrible product,My phone is dead,1,Negative
686,686,Decent product,Don't buy this product.. Having issue with motherboard.. With 6 month my gt dead.,1,Negative
687,687,Waste of money!,dont buy this phone pls its a request .when i buyed it was op .but after the update its full of bugs .one night i switched off my phone and then the morning the phone doesn't turn on the phone was dead.My phone dead in 8 months.its mother board is completely broken,1,Negative
688,688,Decent product,Friend cam not better,2,Negative
689,689,Simply awesome,This phone is complete phone camera is better and gaming performance is excellent,5,Positive
690,690,Worth every penny,Best for gaming i love it,5,Positive
691,691,Value-for-money,A very good product at this price..But need to fix.. its vibration Otherwise 👍Display is LCD but... amazing.. to watch multimedia...A little bit heavier..but it's ok...Camera is ok.p,4,Positive
692,692,Useless product,"The phone has a very good processor and storage speed but the back is vibrating too much while playing songs/games due to ""stereo"" speakers. Battery backup is poor considering 5160mAh battery. It charges too slow while playing games. It took around 4 hours to charge when I was playing Brawl Stars. Facing some frame drops while scrolling feed on youtube.",2,Negative
693,693,Good,Please don't buy Battery drains very very fast And gets heated up while charging. Not up to expectation of Snapdragon 855+,1,Negative
694,694,Wonderful,Osm Phone ❤️,5,Positive
695,695,Worthless,Worst Phone !  😭Phone is getting hanged frequently…Visited MI store multiple times still no resolution after formatting and restore.I am a tech expert and a computer engineer I am writing this request for the common people who are thinking of purchasing this device,1,Negative
696,696,Useless product,"Camera is very poor, Totally below average.... Performance is good... Just want to return this product and want my refund back.. As soon as Flipkart grant it.. Very poor job by poco and Flipkart...",2,Negative
697,697,Expected a better product,Camera is above average.comparison other brand 15000/- mobile criteria even this phone lose that comparison. Software some bug are here proximity sensor not working. Gyroscope sensor not working. ghost touch 5 times per day without battery this model faliure. Don't buy this phone,1,Negative
698,698,Pretty good,Best gaming phone X3 pro,5,Positive
699,699,Very poor,Camera very much poor..camera of poco f1 is much bette,2,Negative
700,700,Very poor,Excellent💯💯,5,Positive
701,701,Bad quality,this phone is heating very fast in play pes 2021,5,Positive
702,702,Fair,Auto call recording option is not there. Product wise it's good.,3,Positive
703,703,Not recommended at all,I am writing this review after 2 month. The worst phone I ever seen. what are disappointed me : camera performance not good.very low brightness display(don't have a sunlight mood😐).battery not performing like 5000mah abow.i have touch complaints when playing pubg and using normally.the side mounted finger print sencor not working some time. 120 hz refreshing rate is just a number I didn't ever seen a good performance. If you have a plan to buy a poco phone think once again☹️. Don't waste you...,1,Negative
704,704,Really Nice,Awesome,5,Positive
705,705,Excellent,"Decent camera, Ultimate performance.. Totally Good mobile",4,Positive
706,706,Super!,Osm,5,Positive
707,707,Mind-blowing purchase,"The phone is best in performance, little disspapointment in camera department but it's not meant to be a photocentric phone. This phone is meant for performance and it delivers it perfectly. Speakers are a cherry on the top.",4,Positive
708,708,Worst experience ever!,Worst phone,1,Negative
709,709,Not good,Don't go for it if you love your money.... My device suddenly dead after six months without any damages.... Motherboard issues in many customers devices... Choose wisely!!!,1,Negative
710,710,Expected a better product,"Battery is fine and also is the screen, I bought it for gaming and just using it for 4 months and the performance is very bad now ! Don't buy in 2022 this is garbage!",1,Negative
711,711,Waste of money!,Product not good.. prob appair within 6 months,1,Negative
712,712,Super!,Really this mobile is awesome,5,Positive
713,713,Expected a better product,Hitting issu lag while gaming.. And swithoff autometcklyBugs lags etc.. Mother board issue blast..,1,Negative
714,714,Super!,Nice product ☺️☺️ . Very satisfied with the product.A true mobile for gamers in mid range ❤️❤️,5,Positive
715,715,Must buy!,Phone like pubg god,5,Positive
716,716,Best for the price offered,"Considering the price, the product is excellent for the features given.Battery life: 5 ⭐Performance: 5 ⭐Camera: 3 ⭐Multitasking: 5 ⭐ (6GB is more than enough)Screen: 4 ⭐ (Not AMOLED but 120Hz is a plus)Cons:Only con is when stereo speakers are used at high volumes (like watching a video or when during an incoming call), the back of the phone vibrates. It can be annoying to some people who use speakers quite often.   Also, during a phone call, the handset is very loud and people next ...",4,Positive
717,717,Awesome,I used this phone for 6 months but it get lag when u play bgmi and when players come closer to you. It has heating problems it get heat when u play or when you charge other wise it is beast of 2021,2,Negative
718,718,Did not meet expectations,Poco fail don't buy.,1,Negative
719,719,Useless product,Phone is dead,1,Negative
720,720,Hated it!,Touch issue and after update device is slow and too laging,2,Negative
721,721,Wonderful,Uh,1,Negative
722,722,Unsatisfactory,Mobile is dead  in just 5 months.. And now I just kept it in a corner Waste of money 😒,1,Negative
723,723,Not recommended at all,Overheating,2,Negative
724,724,TOUCH ISSUE DURING GAMING,TOUCH ISSUE WHILE GAMING,3,Positive
725,725,Nice product,Screen is just amazing not having any problem with that.I think the phone is quite thick according to the battery capacity and also quite on the havior side.camera is ok if you are looking for this device for camera I would not recomend this one.just for gaming.No hang or lag but a bit of heat and that's ok.,3,Positive
726,726,Not recommended at all,Battery is getting drained so fast even after having 5000 mah battery. And display quality is very poor.,1,Negative
727,727,Nice,Sometimes phone call not receiving my voice clearly,2,Negative
728,728,Useless product,Only it had a powerful processor rest of the things are very low quality.... little excessive use leads to software hardware failures...i lost my phone mother board just in 3 months.,2,Negative
729,729,Hated it!,Worst phone ever!...multiple touch(ghost-touch) issues will come within 2 months...screen flickering and touch problem will always comes..cheap build quality..I recommend not to buy poco x3 pro,1,Negative
730,730,Not recommended at all,Battery draining like hell.  Please don't buy this product. Because battery is more important than anything. Iam submitting this review after one month of use. And battery heating issues during charging. And for video call after 30 mins back camera gets heated. Rest all is ok with it. But battery is main disadvantage in this. Complete failure of battery,1,Negative
731,731,Terrific purchase,More than expectationValue for money,1,Negative
732,732,Useless product,Sounds is not good as I expected. Sound is disorder flipkart and his team or service agent are totally bakvass doesn't know how to handle the customer. once products is sealing done then after they're doesn't flipkart know you. This thing I haven't exactly expected from flipkartService are horrible😱in flipkart,2,Negative
733,733,Utterly Disappointed,The camera is very poor. And camera quality is also bad. Dont buy this phone if you are looking for good camera phone,1,Negative
734,734,Worst experience ever!,Don't buy this phone because touch issues are very irritating .Worst phone ever,1,Negative
735,735,Terrific,I just bought this mobile for Pubg and I love the performance of this mobile. No lag even if there are so many squads near. Charging also seems to be pretty fast. As of now I don't see any disadvantages in this mobile. Will update if any issues after a monthly use.,5,Positive
736,736,Absolute rubbish!,Excellent phone.. But the fast charger i got with this phone was not working.. I didn't use it atleast for 1 time. Worst experience,3,Positive
737,737,Best in the market!,It's awesome.. This Phone born for games.Example.. Free fire and Pubg,5,Positive
738,738,Very Good,"Best phone for gaming under 20k(1) SD 860 really works excellent, (2) 33 watt fast charging work as I expected, (3) UFS 3.1 decent(4) Camera & Display are average but refresh rate and touch sampling rate works properly, (5) It has some vibration issue from back pannel when I played music in loud speakers,(6) It's bulky but compromised, (7) It has some heating issue but liquid cooling manage it.",4,Positive
739,739,Does the job,Battery is not up to the markCamera is ok Budget phone,3,Positive
740,740,Worst experience ever!,Screen touch is very bad,1,Negative
741,741,Delightful,If u r using poco f1 then stick with that bz after shifting from f1 i dont feel I done a good job bz besides display and battery everything is much better in poco f 1 but if u are first time buyer Or upgrading from another then go for it bz it's beast under 20k,3,Positive
742,742,Super!,for gaming its good device under 20k,4,Positive
743,743,Not good,Camera features are not so really☹️☹️☹️ This is not fair . But otherwise it's good,3,Positive
744,744,Terrific,Day2 only one problem back side vibration no lag no frame rate even u play games for 3or4or5 hours no lag value for money.,1,Negative
745,745,Best in the market!,Best mobile phone in low price great processor and smooth screen,5,Positive
746,746,Best in the market!,Product is best in class but delivery was very worst,3,Positive
747,747,Wonderful,Very heat,3,Positive
748,748,Brilliant,"Absolutely value for money..Snapdragon 860 working really outstanding, specially in below 20K price range.No any heating issue at all.And many says camera is bad and etc. Please note that camera pictures quality is very good honestly.Also battery charge faster and excellent battery life.",5,Positive
749,749,Fabulous!,Supar,5,Positive
750,750,Must buy!,Great phone value for money  but for other people it should be in offer so they get in affordable price,4,Positive
751,751,Delightful,"Best gaming phone but sometimes something issues like,bagge.",4,Positive
752,752,Terrific,Nice picture quality,4,Positive
753,753,Worth every penny,Best for gaming,5,Positive
754,754,Nice product,I just love this phone,5,Positive
755,755,Good choice,Front camera,4,Positive
756,756,Did not meet expectations,Worst phone I have never seen,1,Negative
757,757,Highly recommended,Nice products 😊,5,Positive
758,758,Absolute rubbish!,"Don't buy, very bad Profomance",1,Negative
759,759,Utterly Disappointed,Dont buy this phone. It gets mother board probelm . I took 8 months ago now the phone is dead and the didnt give warranty if it get scratches,1,Negative
760,760,Moderate,Wasted money. .. dead issue,1,Negative
761,761,Worthless,I am not happy Flipkart u can't help me you create my problem to much My guarantee has been terminated by getting Flipkart Poco😭😭 to much sad my 19000 money is wasted,1,Negative
762,762,Useless product,After using POCO F1 for 2 years I bought poco x3 pro last year but this phone totally disappointed me. Don't ever think to buy it even you are a gamer or what. Never think to buy it,1,Negative
763,763,Worst experience ever!,Bad mobile,1,Negative
764,764,Waste of money!,After using for few months the mobile doesn't turn on.The screen goes blank and doesn't turn on.,1,Negative
765,765,Terrible product,"I bought this phone before 11 months , it was soooooo good till yesterday 🥲 and suddenly my phone is dead it is not turning on 🥲i wanna",1,Negative
766,766,Slightly disappointed,So many bugs in mobile,1,Negative
767,767,Don't waste your money,My poco x3 pro dead ... no heavy use ... motherboard quality is not good,1,Negative
768,768,Don't waste your money,Never buy poco Mobile.everyone phone became dead,1,Negative
769,769,Not recommended at all,Don't buy poco brand phones it will dead after warranty expired..............,1,Negative
770,770,Terrible product,"Only 7 months used  after deth,l😞😖",1,Negative
771,771,Did not meet expectations,Very laggy no updates heating issues,2,Negative
772,772,Horrible,After 1 year of usage the motherboard died,1,Negative
773,773,Useless product,My x3 pro got mother board dead in just 4month,1,Negative
774,774,Waste of money!,worst product its like a 3080 with a windows 95 cpu motherboard....total guerilla spec max to max 7-8 months handset life...after that adios,1,Negative
775,775,Horrible,"Very bad phone for recommending anyone for buying,phone's mother board got spoiled and when you go to service center you have no choice but to switch to redmi note 10 pro.I would recommend everyone to not even think to buy a phone of poco brand.....It was a very bad experience",1,Negative
776,776,Very poor,Most pathetic phone I purchased,1,Negative
777,777,Worthless,This phone is dead today,1,Negative
778,778,Classy product,Good phone,4,Positive
779,779,Terrific,I think under 20000 the best phone,5,Positive
780,780,Nice product,Good value for money but some times hanging issue and also heating,3,Positive
781,781,Does the job,The phone is fast but the launcher stutters. You can feel the stutters here and there. I don't know why this is happening even with the SD 860. It had a 120 hz refresh rate screen but you can feel the drops at times due to the stutters.,3,Positive
782,782,Value-for-money,"Very good phone , mind blowing",5,Positive
783,783,Don't waste your money,BATTERY DRAINS VERY FAST SO AVOID TO BUY,1,Negative
784,784,Nice product,This phone heats up but the performance is very good and the battery of this phone could have been batter but very cool phone for gamerse,4,Positive
785,785,Did not meet expectations,Battery drain quickly. Not worth above 5000mah battery. At the time of taking video hanging issue continuesly.,2,Negative
786,786,Terrible product,Worst phone dont go for it. Call is being disconnected time and again. Others phone is showing switched off while that is on. Front camera not good.Tab switch not working. Don't buy this phone. Flipkart support so far is worst.,1,Negative
787,787,Super!,Super product it is really gameing mobileYou don't very this is nise productAnd loo light look super,5,Positive
788,788,Unsatisfactory,Camera problem after miui 13 update don't update your poco x3 pro phone my mobile is also motherboard crashed,1,Negative
789,789,Utterly Disappointed,Pocox3pro dead,1,Negative
790,790,Worthless,Poco x3 pro bad mobile dead issue,1,Negative
791,791,Worst experience ever!,"My poco x3 pro was completely dead in 9 months, so don't buy this product or don't buy POCO & Mi brand also.",1,Negative
792,792,Worthless,My poco is dead that's why i review 1* otherwise mobile is ok,3,Positive
793,793,Very poor,Very bad product and it was not working properly,1,Negative
794,794,Not good,"Don't buy this, it's having board complaints. Please don't buy this.",1,Negative
795,795,Unsatisfactory,"Don't buy this phone,my phone's mother board was gone in 8 month's only.Please don't waste money on this phone",1,Negative
796,796,Worthless,Fuddu phone,5,Positive
797,797,Waste of money!,Don’t waste your money very bad phone and very bad after sales service don’t waste your hard earned money i buy this phone 4month ago and one day it suddenly dead,1,Negative
798,798,Fair,Phone weighs more in hand. Can't put in hand for continuously. Battery is good. Heating issues seen in heavy load conditions. Stereo speakers making heavy vibrations at the back body in high volume case. Overall ok to use.,3,Positive
799,799,Fair,"Phone is heavy and the camera average , display average",3,Positive
800,800,Just okay,Bettery performance not good,2,Negative
801,801,Awesome,Touch it not working 😤😤😤,1,Negative
802,802,Just okay,"Cons- Phone is not handy at all, Camera is Worst. Pros.-  Mind blowing Performnce.",1,Negative
803,803,Not recommended at all,Bad phone,1,Negative
804,804,Could be way better,Camera is a not good,1,Negative
805,805,Nice,not happy with battery performance. Screen resolution is really good. Speaker is loud n clear.,2,Negative
806,806,Brilliant,Guy's literally I am saying if you are still looking the best smartphone under 20k  (on offer you can easily get this on 17k ) go for this blindly dude & i am sure you will never regret it. it's damn amazing in every aspect  .,5,Positive
807,807,Highly recommended,Nc,3,Positive
808,808,Mind-blowing purchase,Just awesome phone,5,Positive
809,809,Excellent,Awesome I like,5,Positive
810,810,Mind-blowing purchase,GAMING - 10 BATTERY-08CHARGING-09CAMERAS-06Paisa wasool phone Best gaming experience,5,Positive
811,811,Good choice,Good phone in this range 16999 I buy it but one prblm doesn't support 5G,4,Positive
812,812,Terrific,Best gaming Beast under 20k,5,Positive
813,813,Value-for-money,"The product is good, worth for money. Overall everything was good but delivery was delayed for 1day which I was little disappointed.",4,Positive
814,814,Nice product,"Not bad, but back vibration too much. ❤️ It 😂😂😂",3,Positive
815,815,Very Good,Night mode is awesome,5,Positive
816,816,Wonderful,If you want a midrange killer with high performance then you don't need to look for another device. This is best and Display is super. And I'm the developers of Poco launcher also.,5,Positive
817,817,Excellent,Great performance,5,Positive
818,818,Worst experience ever!,Wast phone fore ever,5,Positive
819,819,Terrible product,One of the worst phone didn't even use for 6months it got damaged,1,Negative
820,820,Did not meet expectations,Guys believe me dont go fot this stupid phone because i bought it after 11 months its dead now and im im depression because im helpless i cant do anything pls dont buy this please,1,Negative
821,821,Wonderful,"MOST WORST PRODUCT FROM POCO SERIES. AFTER USING 6 MONTHS MY MOBILE BECOME DEAD. IF THEY CAN'T CONTROL THEIR UPDATE THEN DON'T PUSH IT ON POCO X3 PRO SERIES. IN INDIA MANY MIDDLE CLASS FAMILY BOUGHT POCO X3 PRO AS THEIR DREAM BEAST PHONE, BUT NOW IT BECOME A TRASH.",1,Negative
822,822,Utterly Disappointed,Worst phone in history,1,Negative
823,823,Utterly Disappointed,Motherboard got damaged Phone is bricked,1,Negative
824,824,Classy product,Phone performance is very good.But camera and battery backup is slightly good,4,Positive
825,825,Waste of money!,Not happy 😞😞,1,Negative
826,826,Unsatisfactory,Not good working after 5 or 6 months.,1,Negative
827,827,Moderate,Camera started lagging since the first week... Phone too lags sometimes.,2,Negative
828,828,Worst experience ever!,When I Recording Free Fire Gameplay With Screen Recorder It Sounds Very Bad like double Sound Coming Please Fix It ....,1,Negative
829,829,Waste of money!,"At 1st the phone's performance was good but after 2 software updates the phone is trash, don't buy this phone i regret buying this phone not good for gaming also not value for money",1,Negative
830,830,Did not meet expectations,dont buy this phone,1,Negative
831,831,Not recommended at all,My phone is dead waste,1,Negative
832,832,Waste of money!,Net work problem,3,Positive
833,833,Absolute rubbish!,Don't buy this mobile because heavy lag and always stock,1,Negative
834,834,Terrible product,Not bad,3,Positive
835,835,Must buy!,"I am very satisfied with this mobile I downloaded bgmi and played it , after 6 months also there is no lag ir framedrop while playing . If you are a heavy gamer this device will be the best choice below 20000. But you dont hope about the camera.Battery is also ok",4,Positive
836,836,Brilliant,All future is outstanding 👍😊💞,5,Positive
837,837,Terrific,Gaming phone !! Specially for pubg ...,5,Positive
838,838,Horrible,Plz dont buy this phone due to hardbrick and motherboard issue,1,Negative
839,839,Worthless,Auto dead my phone,1,Negative
840,840,Worst experience ever!,Blank display problem 🥲,1,Negative
841,841,Simply awesome,Nice,4,Positive
842,842,Don't waste your money,"Plz don't buy this product, I had used 1 year once update the software my mobile won't work properly I am facing so many issues Like camera video not capture clearly, once switch off and on the will work",1,Negative
843,843,Highly recommended,Rear camera awesome🔥🔥😘,4,Positive
844,844,Not recommended at all,Having lot of issue with working of the mobile won't auto rotate even if it is on call sensor won't work,2,Negative
845,845,Horrible,Worst performance,1,Negative
846,846,Unsatisfactory,Worst mobile don't buy,1,Negative
847,847,Bad quality,Worst product,1,Negative
848,848,Super!,Camera good performance good sound goods.. It's all good.. ❤👍,4,Positive
849,849,Highly recommended,Best in price.,5,Positive
850,850,Terrific,Best value for money gaming phone,5,Positive
851,851,Utterly Disappointed,Please don't buy this smartphone motherboard dead after update,1,Negative
852,852,Really Nice,Awesome phone.... Just ❤👌💯,5,Positive
853,853,Awesome,Best performance under 20k Best cameraBest displayOverall best phone under 20k,5,Positive
854,854,Very poor,"Am very very much disappointed with flipkart and this product also.... I have many issue with this product.. 1. I have two mobile no in this phone..... If I login personal account on flipkart and hotstar and truecaller like this apps it shows another mobile no... I don't have that mobiles in my life.... It shows 3 mobile no's... I thought am not the first user of this product..... I raised a return request, the tech guy also came and checked this product he also don't know about this issue a...",1,Negative
855,855,Great product,Best Mobile under 20k♥️,5,Positive
856,856,Terrible product,"It's not a phone, it's a BRICK. If accidentally fell down in your legs, fracture confirm!! Girls don't even think of lifting this phone.In addition poor signal reception.",1,Negative
857,857,Perfect product!,Bought for 17k (6gb 128gb) Great battery  and display Camera disappointedExtream erformance(SD 860) Great graphics for pubg Don't go for bronze colour,2,Negative
858,858,Fair,Nice phone,5,Positive
859,859,Terrific purchase,Best photo.... camera is very good,5,Positive
860,860,Terrific purchase,Its totally jod for gamer's,5,Positive
861,861,Terrific purchase,Nice,4,Positive
862,862,Very poor,"I have Bought POCO X3 Pro for My Brother.After Superfast delivery by Flipkart ,my Brother was so happy that He will do gaming with this phone but the phone has start doing plenty of drama from day 3.He thought that may be there will be something om screen ie water or sweat so touch is not working properly but After using 1 month phone has disappointed a lot.While playing the game there was huge frame drop and very bad experiences.Touch was not working properly every time .Touch was working o...",2,Negative
863,863,Super!,Best for pubg in high graphic,5,Positive
864,864,Brilliant,Best gaming phone poco x3pro 🥰📱🔥(♥ω♥*)💛💛💛💛💛💛💛☎👧💓💓💓👦☎📱👗👉❗👈👕📱☎👖Call  me 👖☎💛💛💛💛💛💛💛🎩😁👕👍Great!👖,5,Positive
865,865,Fair,"Poor design, Unlock touch is not on front screen!! Purchased it bcoz of it's performance but in one month it starts hanging!!",1,Negative
866,866,Perfect product!,Good BatteryGood photosBest processor performanceBest gaming performanceBest cameraAverage body design,4,Positive
867,867,Absolute rubbish!,Battery backup bad,1,Negative
868,868,Highly recommended,Best Gaming Phoneand No Emi Cost on Bajaj Card,5,Positive
869,869,Just okay,This is a good phone in this price range. The performance is very good. The camera quality is bad,4,Positive
870,870,Worth every penny,Flikkart thank you so much,5,Positive
871,871,Just wow!,I fill to good by useing,4,Positive
872,872,Value-for-money,Best budget phone  with overloaded features  go for it,5,Positive
873,873,Good,In bgmi touch issue have problem,3,Positive
874,874,Terrific,Super phone,5,Positive
875,875,Must buy!,Amazing mobile,5,Positive
876,876,Simply awesome,phone has ghost touch issues. it becomes very irritating sonetimes. never going to buy poco again in future,1,Negative
877,877,Excellent,Best for pubg under 20000,5,Positive
878,878,Good quality product,Very nice,5,Positive
879,879,Worth every penny,"Good phone but os experience is not that good, that's not miui from redmi series , animations needs optimisation, not all features from miui rom",3,Positive
880,880,Just wow!,"Just go for it , This machine does it's job . 1)Camera 🔥2) Performance 😍3)Battery (10hrs on Hotspot ,video editing , high end games ) 30 % remains for the day.4)No heating issues 5) Machine is awesome",5,Positive
881,881,Pretty good,The phone is very nice and it has value for money. The camera is also great and the battery backup is also very good.,5,Positive
882,882,Excellent,i loved to play games on this phone. but camera is one one of the cons of this phone.,4,Positive
