,Unnamed: 0,Review Title,Review Text,Score,Class
1118,1118,Terrific purchase,Best phone for gaming under 20 k,5,Positive
1119,1119,Decent product,Very costly,5,Positive
1120,1120,Highly recommended,A good phone for games. Camera is average. Face unlock and finger print is super fast. Charging takes 1 hour and slight heating issues if you play games but cools down very fast.,4,Positive
1121,1121,Worth every penny,Awesome performance . One of the best phone.,5,Positive
1122,1122,Good quality product,Worth the price.,4,Positive
1123,1123,Excellent,Nice Specs in this price range,4,Positive
1124,1124,Super!,Good phone,4,Positive
1125,1125,Perfect product!,Performance is very good but camera is definitely disappointed and display is definitely very nice,3,Positive
1126,1126,Worth every penny,Supar mobile,5,Positive
1127,1127,Terrific,Best mid range budget phone ever,5,Positive
1128,1128,Good quality product,Good Product. But the device needs to be more optimised.,4,Positive
1129,1129,Terrific purchase,Underrated Mobile in this Price. POCO AD free mobile. ⭐⭐⭐,5,Positive
1130,1130,Very Good,Only For Gaming,3,Positive
1131,1131,Terrific purchase,Nice mobile and excellent service,5,Positive
1132,1132,Pretty good,Battery backup Not best And Speaker Is awesome fo music Play back not good in gaming with this speaker performance 98% Satisfaction with 20k,2,Negative
1133,1133,Wonderful,Good phone but Chinese company,3,Positive
1134,1134,Terrific purchase,"Got the phone 1 week ago after waiting for 2 weeks and cancel and order it again.(-)Performance is good but some games still lags a bit (like genshin impact). And i can play CODM on max graphics and fps with no lag.(+)Battery is great, i can use it whole day without charging and including about 3 hours of gaming. Charging speed is good. It takes about 70-75 mins to charge from 20 to 100.(+)I had a problem with the display once. Sometimes swiping the screen from side to side didn't work ...",3,Positive
1135,1135,Just okay,Phone is very light weight we will not feel premium its look like cheaper phone,2,Negative
1136,1136,Good choice,I truly disappointed with product delivery service. I didn't get any feed back link for delivery otherwise it will be 0 zero rating from my end.Rating for phone is 4/5.Camera not upto mark. Rest good to go.,1,Negative
1137,1137,Simply awesome,Awesome day to day use,5,Positive
1138,1138,Terrific purchase,Loved the phone performance out of the world 🌍 👍,5,Positive
1139,1139,Fabulous!,Very good product,5,Positive
1140,1140,Best in the market!,Best phone for BGMI 😍😍,5,Positive
1141,1141,Perfect product!,Osm phone for everything,5,Positive
1142,1142,Terrific,Iam Buy this mobile only for pubg.  No lag in pubg constant 60fps. Rendering only. Camera is not bad also good. Battery backup one day normal use and pubg playing while iam 5 hours played. 120hz display is amazing speed in this mobile. Finally you buy this mobile for gaming this mobile is best choice.,5,Positive
1143,1143,Value-for-money,Nice value for money,4,Positive
1144,1144,Nice,"The phone is absolutely fine, I have used it for 2 months  but there are many bugs, which inventually went down but the ram management is poor we can find some lag while heavy gaming, camera performance is very poor. Battery backup and charging speed it really good it takes 1hr:10min for full charge. On the whole it's a good phone for this price with some compromise.",3,Positive
1145,1145,Excellent,Good performance,4,Positive
1146,1146,Delightful,Best phone in between budget for gamingAll is good except camera,4,Positive
1147,1147,Simply awesome,"It is a good device but they should update it's heating issue I played game for half an hour and it started heating, but it doesn't effected my gaming CAMERA : I think this phone is for gaming and etc. But if you are purchasing this phone for photos then you should check another phoneBecause it's 48 MP and not that clear so, don't purchase it for photos GAMING PERFORMANCE : It is a beast for gaming it can run PUBG OR BGMI in ultraHD+ultra graphics and till HDR it runs Extreme but if you us...",3,Positive
1148,1148,Simply awesome,Unbelievable fast delivery from flip kart I appreciate that and it came to me within 20hours of my order and mobile is good too,5,Positive
1149,1149,Best in the market!,Classy product worth buying,5,Positive
1150,1150,Super!,Nice mobile speed & processor...,5,Positive
1151,1151,Awesome,Phone us just op as scout gameplay... Performance in pubg is never dispointed you,1,Negative
1152,1152,Simply awesome,Overall satisfied with the purchase. Battery backup and performance of the phone are truly amazing.,5,Positive
1153,1153,Highly recommended,Feel good,5,Positive
1154,1154,Delightful,Every thing is good. But some times getting slow.,3,Positive
1155,1155,Worth every penny,Some bugs in ui that will be remov3d by updat3..  overall product is good,3,Positive
1156,1156,Awesome,"Great phone, performs like a beast!",5,Positive
1157,1157,Wonderful,"performance based phone, then go for it Nice Performance and very smooth display. Little heating occurs at camera side while playing games and no other issues",4,Positive
1158,1158,Delightful,Value for money only,1,Negative
1159,1159,Mind-blowing purchase,Nice product but phone vibrate at the time you are playing music and heat problem too,3,Positive
1160,1160,Mind-blowing purchase,Good,4,Positive
1161,1161,Good quality product,This phone is god in performance in this price segment and have descent camera with good stereo speakers in it.The only Cons is MIUI 12 this will makes it quite bad and some features are not working correctly sometimes.,4,Positive
1162,1162,Not recommended at all,"worst phone ever, always frame drops and lag in games despite full network.",1,Negative
1163,1163,Super!,Superb performance but have some heating issue.,4,Positive
1164,1164,Highly recommended,Suparb very nice phone,5,Positive
1165,1165,Classy product,Gaming Performance is Excellent good battery Smooth smartphone 120hz display good,5,Positive
1166,1166,Good choice,Its better phone gaming But camera is poor quality i hope the will improve that on next update,3,Positive
1167,1167,Very Good,nice product with good camera,4,Positive
1168,1168,Very poor,"This phone is now dead, suddenly a screen full of lines appeared and boom it's dead and it's not turning on. :(",1,Negative
1169,1169,Super!,Iam happy with this phoneValue of money and sd860 is goodCamera is high qualityDisplay is good,5,Positive
1170,1170,Bad quality,Device is very bulky.,2,Negative
1171,1171,Delightful,"It has very good processor but it is not optimised, you can observe over heating. It is not that good phone to consider for gaming",3,Positive
1172,1172,Wonderful,"Nice phone But back panel vibration and some heating problems,overall beast  under  20k",3,Positive
1173,1173,Nice product,It is a good phone and will show the quality of snap dragon 860 but when I applyed screan guard and phn cover it seems a problem in touch. It was alright after the removed of screan guard and phone cover.,3,Positive
1174,1174,Best in the market!,"After using this phone for a week, I am too satisfied, it has everything I want, worth buying, it is diamond in the rate of gold, grab it ASAP",5,Positive
1175,1175,Highly recommended,Good value for money,4,Positive
1176,1176,Wonderful,Best smartphone for under 20k,5,Positive
1177,1177,Worth every penny,After a months it's so lag,2,Negative
1178,1178,Good quality product,After using 1nd half month this poco x3 pro is definitely is beast at this price range... Jst go for it...,5,Positive
1179,1179,Very Good,Go for it...its a beast😍😍,4,Positive
1180,1180,Worth the money,"One of the best phone if we are excepting LED display, provided LCD display panel awsome 120Hz. All good.Only 2 problems, the only problemsssssPlaying music or video with more than 70% of volume, the phone having vibration because of plastic back. Its a major issue of this phone. Outside display visibility or direct sunlight visibility slightly low comparing with other phones.",4,Positive
1181,1181,Terrific,"Nice phone, Fast processor, only thing missing is AMOLED display. But doesn't affect gaming and movie experience.",4,Positive
1182,1182,Decent product,"Internet signals are worst than I think I changed different networks, facing same problem Maybe it's software issue but poco team not responding to the issue",1,Negative
1183,1183,Worst experience ever!,Don't Buy. Touch issue 90% of POCO X3 PHONE😢😢,1,Negative
1184,1184,Just wow!,Needless to say about this phone... Those who wants performance for next 3-4 years... Go for it...Display is also good...,5,Positive
1185,1185,Good quality product,It's an amazing phone. AMOLED display would have been great on this device,5,Positive
1186,1186,Awesome,Best gameing phone under 20k,5,Positive
1187,1187,Best in the market!,For gaming purpose mobile is osm,4,Positive
1188,1188,Nice,Display lag some time. And mobile heat issue charging and game time,2,Negative
1189,1189,Nice product,Good performance but average camera And charging is slow back is too much vibrate 🤨,3,Positive
1190,1190,Mind-blowing purchase,I am useing this mobile from last 10 days exlent performance best mobile N value for money killer phone under 20 k even any phone does not equal to it's performance,5,Positive
1191,1191,Expected a better product,A lot of software issues,3,Positive
1192,1192,Very Good,"Good value for money phone,  not for whom are camera centric",4,Positive
1193,1193,Nice,Heating isssue,4,Positive
1194,1194,Simply awesome,Super mobile for gaming it support upto 60fps itwill support,5,Positive
1195,1195,Must buy!,Best gaming under 20 k But heat sometime but using fan no heat,4,Positive
1196,1196,Just wow!,The gaming beast under 20k...!!!,5,Positive
1197,1197,Just wow!,"very good product,good battery life,but not good camera",4,Positive
1198,1198,Excellent,Nice phone battery backup nice,4,Positive
1199,1199,Nice,Nice phone,5,Positive
1200,1200,Moderate,"Poco x3 pro, has too much UI bugs, glitch,. After using google camera picture quality improves very much. But MI UI. 12. Has the worst  user experience.",2,Negative
1201,1201,Perfect product!,Delivered one day early and old phone exchanged without any hassle. Battery seems to be draining pretty quick even on 60fps.It is heavy and big.But you should know the compromises you are making for this thing's amazing performance.No overheating.,5,Positive
1202,1202,Delightful,Best gaming mobile,5,Positive
1203,1203,Must buy!,Performance is,4,Positive
1204,1204,Fabulous!,Nice,4,Positive
1205,1205,Best in the market!,Ok ok camera not bad,3,Positive
1206,1206,Really Nice,A nice phone with few compromises. I am listing out the compromises here:1. No super amoled panel which makes the brightness on this phone's screen a bit on the lower side.2. The phone is heavier than phones with much bigger battery.3. Back panel vibrates a lot when speaker volume is high.4. Camera is okayish quality.Rest all things are A grade.,4,Positive
1207,1207,Super!,Good,4,Positive
1208,1208,Just okay,"Heating issues display not that great,Performance is good but phone gets heated up if we do casual gaming.",3,Positive
1209,1209,Pretty good,"Bought this phone on April 11th and it's really worth for this price. So far didn't get any issues, screen resolution n camera are really good.",5,Positive
1210,1210,Must buy!,If u want flagship processor go for it asap else go for others for normal pirpose Becz its for gammers who want budget phone for gamming,2,Negative
1211,1211,Terrific,It's a best  performance phone best for gaming,5,Positive
1212,1212,Just okay,Phone back is vibrating heavily and the phone heats up high. I bought the phone only for gaming but it heats up heavily,2,Negative
1213,1213,Must buy!,"Excellent mobile at 18999 rupees. Good performance, Working nicely in all aspects.",5,Positive
1214,1214,Wonderful,Awesome,5,Positive
1215,1215,Best in the market!,Value for money ☺,5,Positive
1216,1216,Terrific,Value formoney,5,Positive
1217,1217,Terrific,GOOD PHONEPROCESSOR BEST FOR MONEY,4,Positive
1218,1218,Good choice,Loving it,5,Positive
1219,1219,Fabulous!,Best phone under 20000 Thank you PocoRegards Sangeeta,5,Positive
1220,1220,Nice product,"Osm at this prize range, go for it or camera is also awsome  go for it without any dought",5,Positive
1221,1221,Terrific purchase,Superb superb phone,5,Positive
1222,1222,Best in the market!,Superb mobile for moderate users iam not a gamer........... There are enough features in this mobile for moderate users thtats i can say..........,5,Positive
1223,1223,Terrific purchase,Just WowwYesterday Recieved.,5,Positive
1224,1224,Moderate,Touch pad not working properly,1,Negative
1225,1225,Pretty good,Very good performanceAverage touchAverage displayFor gaming only,4,Positive
1226,1226,Value-for-money,"Performance : GreatBattery: GoodDisplay: fineCamera: ok(usually all camera are ok type in budgeted phones) Great phone under 20k ( Best phone in this budget)Value for money : Definitely yes5G : No (Although yet to come in reality)This is early usage review , I ll update later in upcoming days.After 10 daysCharging : 4% to 94% in 1hr that's great Battery back up goodGames like pubg playing is ultra smooth",4,Positive
1227,1227,Does the job,"Uhm good phone, has a decent camera, damn good performance.Downsides are charging speed battery back up Worst side is ips screen",3,Positive
1228,1228,Pretty good,Display size feels too large. Weight and thickness of phone is little on higher side. But overall its good,3,Positive
1229,1229,Mind-blowing purchase,Performance beast......Backside vibrations as mentioned by other users.Camera quality - Average.VFM  - 5/5,3,Positive
1230,1230,Pretty good,Nice mobile.Awesome delivery and fast,5,Positive
1231,1231,Value-for-money,Screen flickering issue at low brightnessDisplay is average Performance is awesomeBackpanel vibrates Camera is averageBattery is good,3,Positive
1232,1232,"Good phone, bad camera","Phone is ok. But if you are looking for good camera, forget about this. The camera is not as my expectation. Poco f1 was having better camera than this one.",3,Positive
1233,1233,Super!,"If gaming is your priority, blindly go for it. The performance is better than phones which are double to it's price.After 10 days usage, found following cons:1. Battery is powerful but not optimized. 5-6 hrs of game drains it completely. Stand by time is good.2. Any phone with stereo speakers vibrates when on full volume. Back panel vibrates more than normal phone with stereo speakers.3. MIUI lags are there, sometimes scrolling works but tap doesn't. Unable to select or open apps then...",2,Negative
1234,1234,Just okay,Phone is good but front camera is very bad  very very bad camera,2,Negative
1235,1235,Very Good,Notable issues Back panel vibrationI've noticed some display related problems like Brightness is too low when compared to POCO X2 and M2 ProI've noticed screen flickering during gamingIPS LCD display is Ok - Ok (not that great ),3,Positive
1236,1236,Good,The product is alright but when playing something it vibrates and when installing certain apps for the first time its getting very hot and the apps closing on itself.Overall I will provide the detailed review letter after using one month.,3,Positive
1237,1237,Worth the money,Only for gamers... If you are not that much into gaming better find another option.,2,Negative
1238,1238,Best POCO phone ever.,This is the best version of Poco Phones. You will not regret it.,5,Positive
1239,1239,Classy product,Best budget phone under 20k,5,Positive
1240,1240,Super!,Superb mobile.,5,Positive
1241,1241,Terrific,Everything is good but the battery backup is an issue.,3,Positive
1242,1242,Terrific,Totally beast but no amoled display,3,Positive
1243,1243,Brilliant,Camera not good. Only pros are good processer and fast charge  ... ConsSome times touch response go delayed by a sec.. Which will irritate you,2,Negative
1244,1244,Terrific purchase,Best gaming device under 20k....,5,Positive
1245,1245,Awesome,Very good,5,Positive
1246,1246,Just okay,"Shifting from honor User to Xiaomi, i am missing most of simple and beautiful UI, thinking of why i bought in name of processor. When everything is matter in phone. Will move to another phone soon.",2,Negative
1247,1247,Hated it!,dont buy this phone is dead after update miui 13.0.2 and my device is out of warrenty company didn't responcible  to change the device its software issue poco will be concern that issue and change the device free of cost,1,Negative
1248,1248,Just wow!,"Two Downsides It is the fkg back vibration on any audio video playback, vibration bcoz of top speakerIt's the irritating bug2nd one is most of the users getting Tianma panel for display so facing ghost touch issues.I just got ghost touch issuesNeed to get replace to huaxing panel which is reliable",2,Negative
1249,1249,Simply awesome,I think this us the best performance centric device ever in this budget becomes more powerful than the other In cod mobile constant 60 fps,5,Positive
1250,1250,Hated it!,"This is one of the no 1 bad quality phone in this segment. After purchase within one month the display started autotouch issue. After display change the proximity sensor stops working, again done servicing. After two days light sensor stop wrking agin done servicing and after that i sold it and buy new phone",1,Negative
1251,1251,Must buy!,It's the mid range flagship phn must buy for new comers in pubg to get a latest experience and regarding battery backup it's super but I must say that the delivery boy must unbox the parcel for a genuine review,4,Positive
1252,1252,Worth the money,PHONE IS SO HEAVY AND THICK. PHONE VIBRATES TOO MUCH.,2,Negative
1253,1253,Fabulous!,If your looking for the best performance phone under 20k . Here is the device . This device will handle any have apps easily .. best gaming device under 20k... playing CoD and PUBG is out of the world experience.. no frame drops.. no device lag I didn't felt any thermal throttling yet in normal room temperature.,5,Positive
1254,1254,Brilliant,Excellent product with good quality and adorable performance within the squib price is beyond imagination. Dare to think of the affordability.,5,Positive
1255,1255,Excellent,very good 👍 pubg mobile  no lag  no leg no issue is Unstoppable performance I am so happy and I am using Poco X3 Pro,5,Positive
1256,1256,Really Nice,"Game oriented mobile, except for processor everything else is pretty ordinary comparable to 10k phone. Sad but true.",3,Positive
1257,1257,Excellent,Excellent,5,Positive
1258,1258,Great product,Awesome 😍,5,Positive
1259,1259,Perfect product!,There is a flagship processer under 20k ... Macro camera has to improve.. And yeah it's ok for this price range.....,3,Positive
1260,1260,Best in the market!,Superb quality.... performance is beast,5,Positive
1261,1261,Pretty good,Very good Prosser in this prise res,5,Positive
1262,1262,Fabulous!,Everything good performance beast.. Camera poor poco f1 camera is batter than this. For gaming this mobile is the best choice,4,Positive
1263,1263,Worth every penny,This is best phone under 20k,5,Positive
1264,1264,Simply awesome,"The back panel feels cheap, it vibrates a lot while playing audio",2,Negative
1265,1265,Wonderful,Heptic mode not there in settings.,2,Negative
1266,1266,Must buy!,Beast in performance. If you are a gamer you are gonna love this phone for sure.,5,Positive
1267,1267,Brilliant,I really love it it's really good phn to buy for gaming,5,Positive
1268,1268,Mind-blowing purchase,Nyc phone but charging is not fast as advertising,3,Positive
1269,1269,Great product,GAMING BEAST,5,Positive
1270,1270,Fabulous!,Go for it,5,Positive
1271,1271,Mind-blowing purchase,Super phone in budget.,5,Positive
1272,1272,Super!,nice product for gaming,4,Positive
1273,1273,Good choice,It's so nic working,3,Positive
1274,1274,Worth every penny,Value for money 💸,5,Positive
1275,1275,Brilliant,Excellent product at this price segment,5,Positive
1276,1276,Just wow!,Best for gaming,5,Positive
1277,1277,Just wow!,"Good quality,. Value price,  camera quality is very good,  design average",4,Positive
1278,1278,Terrific purchase,THIS PHONE IS BEST GAMING PHONE IN 20000,5,Positive
1279,1279,Excellent,if you buy it for playing PUBG....... ya its killer divice...... best in this price,5,Positive
1280,1280,Good choice,"Its really very good device for day to day purpose & its just a proper flagship ,good in gaming",5,Positive
1281,1281,Perfect product!,Excellent performance oriented phone in this budget range winner winner chicken dinner,5,Positive
1282,1282,Good quality product,Excellent battery life and pretty good speed charging.Good camera for this range.I am play pubg in this phone.,5,Positive
1283,1283,Highly recommended,"I'm Very happy... Buying 16,999",5,Positive
1284,1284,Decent product,Must buy,5,Positive
1285,1285,Great product,Best phone ever,5,Positive
1286,1286,Not recommended at all,It's been 3 month since I purchased this phone. I am facing ghost touch issue. Generally this issue comes when phone is 2-3 year old or when touch is dead. But as expected the product of China this issue comes only at 3 months. Please don't buy this phone. Or I say don't buy any Chinese company phone.,1,Negative
1287,1287,Simply awesome,For performance it is value for money,4,Positive
1288,1288,Good quality product,"Reviewing after using it for 1 week.. In every aspect, it is a beast...in performance specially.The Camera is decent enough,not the best in its segment.The display is smooth,giving the Gaming experience a whole another level. The brightness is decent...in harsh daylight it works not that great. The backpanel vibrates when the volume is high. Except these drawbacks everything is perfect.& The UI... Till now it doesn't give any adds. U can also uninstall the unnecessary apps..So. Overall ...",3,Positive
1289,1289,Mind-blowing purchase,Awesome flagship at this price!Buttery smooth go for it!,5,Positive
1290,1290,Nice product,Beast of performance..Gamers never settle mobile phone...,1,Negative
1291,1291,Good choice,Best phone under 19000,5,Positive
1292,1292,Very Good,Better for gaming Sound is not perfect because back is very vibration,3,Positive
1293,1293,Excellent,Very nice,5,Positive
1294,1294,Excellent,Super perfomence,5,Positive
1295,1295,Horrible,Please do not buy this phone... Over heating is the major issue... Horrible experience... Never expected..,1,Negative
1296,1296,Worst experience ever!,Worst Mobile phone Dont buyHanging Issue Heating IssueNot fast charging Heavy WeightProcessing average Very slow phone,1,Negative
1297,1297,Unsatisfactory,Guys! Don't go for YouTuber reviewsCamera- No clarity while zoomDisplay- Not a good display,1,Negative
1298,1298,Terrific purchase,Best phone for gaming under 20 k,5,Positive
1299,1299,Decent product,Very costly,5,Positive
1300,1300,Highly recommended,A good phone for games. Camera is average. Face unlock and finger print is super fast. Charging takes 1 hour and slight heating issues if you play games but cools down very fast.,4,Positive
1301,1301,Worth every penny,Awesome performance . One of the best phone.,5,Positive
1302,1302,Good quality product,Worth the price.,4,Positive
1303,1303,Excellent,Nice Specs in this price range,4,Positive
1304,1304,Super!,Good phone,4,Positive
1305,1305,Perfect product!,Performance is very good but camera is definitely disappointed and display is definitely very nice,3,Positive
1306,1306,Worth every penny,Supar mobile,5,Positive
1307,1307,Terrific,Best mid range budget phone ever,5,Positive
1308,1308,Good quality product,Good Product. But the device needs to be more optimised.,4,Positive
1309,1309,Terrific purchase,Underrated Mobile in this Price. POCO AD free mobile. ⭐⭐⭐,5,Positive
1310,1310,Very Good,Only For Gaming,3,Positive
1311,1311,Terrific purchase,Nice mobile and excellent service,5,Positive
1312,1312,Pretty good,Battery backup Not best And Speaker Is awesome fo music Play back not good in gaming with this speaker performance 98% Satisfaction with 20k,2,Negative
1313,1313,Wonderful,Good phone but Chinese company,3,Positive
1314,1314,Terrific purchase,"Got the phone 1 week ago after waiting for 2 weeks and cancel and order it again.(-)Performance is good but some games still lags a bit (like genshin impact). And i can play CODM on max graphics and fps with no lag.(+)Battery is great, i can use it whole day without charging and including about 3 hours of gaming. Charging speed is good. It takes about 70-75 mins to charge from 20 to 100.(+)I had a problem with the display once. Sometimes swiping the screen from side to side didn't work ...",3,Positive
1315,1315,Just okay,Phone is very light weight we will not feel premium its look like cheaper phone,2,Negative
1316,1316,Good choice,I truly disappointed with product delivery service. I didn't get any feed back link for delivery otherwise it will be 0 zero rating from my end.Rating for phone is 4/5.Camera not upto mark. Rest good to go.,1,Negative
1317,1317,Simply awesome,Awesome day to day use,5,Positive
1318,1318,Worth the money,Under 20k Best Mobile For Gaming,5,Positive
1319,1319,Great product,"Perfect! And if you think it's an IPS LCD display, then the difference is just of the brightness and the blacks are ""BLACKS"". Performance is 15 out of 10! EXTRAORDINARY!!!!!!!! High graphics NOT A PROBLEM. The only problem is that the VIBRATIONS of audio🔊 are at the extreme level 💯. It's TOO MUCH! CAMERA is GOOD. The VIBRATIONS 😖.",5,Positive
1320,1320,Wonderful,Great phone with the specifications. good choice for game lovers.,5,Positive
